timestamp,url,text
2025-07-16 11:30:00+00:00,https://www.fool.com/investing/2025/07/16/should-you-buy-nu-holdings-while-its-below-13/?source=iedfolrf0000001,"Should You Buy Nu Holdings While It's Below $13? Nu Holdings is a digital banking company operating in Brazil, Mexico, and Colombia with 119 million customers. The company has shown impressive revenue growth, positive net income, and strong unit economics, trading at an attractive valuation."
2025-07-16 12:30:00+00:00,https://www.fool.com/investing/2025/07/16/top-buffett-stocks-to-buy-and-hold-for-long-haul/?source=iedfolrf0000001,"2 Top Buffett Stocks to Buy and Hold for the Long Haul Warren Buffett is retiring from Berkshire Hathaway after an incredible track record. The company's top holdings, Apple and American Express, demonstrate strong business fundamentals and potential for long-term growth, despite current market challenges."
2025-07-17 11:10:00+00:00,https://www.fool.com/investing/2025/07/17/2-no-brainer-warren-buffett-stocks-to-buy-right-no/?source=iedfolrf0000001,"2 No-Brainer Warren Buffett Stocks to Buy Right Now The article explores Warren Buffett's investment principles, highlighting Amazon's AI potential and Berkshire Hathaway's financial stability as strong investment opportunities in the current market landscape."
2025-07-20 05:23:00+00:00,https://www.fool.com/investing/2025/07/20/apple-warren-buffett-berkshire-aapl-brk-buy/?source=iedfolrf0000001,"Could Apple Soon Lose Its Top Position in Warren Buffett's Portfolio? As Warren Buffett prepares to step down as Berkshire Hathaway's CEO by 2025, the company's significant Apple investment, initially driven by Ted Weschler and Todd Combs, may see strategic adjustments based on valuation rather than leadership change."
2025-07-20 07:25:00+00:00,https://www.fool.com/investing/2025/07/20/2-no-brainer-warren-buffett-stocks-to-buy-right-no/?source=iedfolrf0000001,"2 No-Brainer Warren Buffett Stocks to Buy Right Now Warren Buffett, at 94, is preparing for retirement from Berkshire Hathaway, leaving behind an impressive investment legacy. He recently invested in Amazon and Pool Corp., two companies with strong business models and potential for long-term growth."
2025-07-21 06:44:00+00:00,https://www.investing.com/analysis/sp-500-earnings-financials-start-q2-with-a-bang-another-solid-quarter-ahead-200663994,"S&P 500 Earnings: Financials Start Q2 With a Bang; Another Solid Quarter Ahead? Q2 2025 earnings season begins with strong financial sector performance, showing positive early indicators with an upside earnings surprise of 7.2% and financial sector specifically experiencing a 10% upside surprise."
2025-07-21 09:41:00+00:00,https://www.investing.com/analysis/this-big-dividend-soared-120-but-still-looks-undervalued-200664015,"This Big Dividend Soared 120% but Still Looks Undervalued The article discusses the potential of investing in closed-end funds (CEFs) during market volatility, highlighting the SRH Total Return Fund as an undervalued investment with a strong historical performance and deep discount to net asset value."
2025-07-21 23:10:00+00:00,https://www.investing.com/analysis/should-you-buy-this-warren-buffett-stock-after-earnings-200664063,"Should You Buy This Warren Buffett Stock After Earnings? Domino's Pizza reported mixed Q2 earnings with revenue growth of 4.35% and same-store sales increases, but missed earnings estimates due to investment losses and higher tax rates. Analysts remain generally positive about the stock's potential."
2025-07-22 11:30:00+00:00,https://www.fool.com/investing/2025/07/22/the-best-warren-buffett-stocks-to-buy-with-1000-ri/?source=iedfolrf0000001,"The Best Warren Buffett Stocks to Buy With $1,000 Right Now The article discusses two stocks in Berkshire Hathaway's portfolio - Amazon and Coca-Cola - as potential investment opportunities, highlighting their unique strengths in e-commerce, cloud computing, and beverage markets."
2025-07-22 19:35:41+00:00,https://www.benzinga.com/trading-ideas/rumors/25/07/46557532/is-warren-buffetts-347-billion-cash-buying-railroads-heres-what-the-oracle-of-omaha-said,"Is Warren Buffett's $347 Billion Cash Buying Railroads? Here's What The Oracle Of Omaha Said Warren Buffett denied working with Goldman Sachs on a potential railroad acquisition, but speculation continues about potential consolidation in the railroad sector, with Union Pacific exploring a merger with Norfolk Southern."
2025-07-23 07:05:00+00:00,https://www.fool.com/investing/2025/07/23/if-i-could-only-buy-and-hold-a-single-stock-this-w/?source=iedfolrf0000001,"If I Could Buy and Hold Only a Single Stock, This Would Be It. Brookfield Corporation is a global investment firm with a strong track record of creating shareholder value, offering diverse businesses in asset management, wealth solutions, and operating businesses. The company has potential to grow its per-share value significantly over the next five years."
2025-07-23 14:17:00+00:00,https://www.fool.com/investing/2025/07/23/bank-of-america-is-one-of-the-largest-financial-co/?source=iedfolrf0000001,"Bank of America Is One of the Largest Financial Companies by Market Cap. But Is It a Buy? Bank of America is the second largest U.S. bank with strong financial performance, impressive technological adoption, and potential investment value in the current market environment."
2025-07-23 16:32:01+00:00,https://www.fool.com/coverage/filings/2025/07/23/bright-rock-dumps-25000-shares-buffett-berkshire/?source=iedfolrf0000001,"Bright Rock Dumps 25,000 Shares of Warren Buffett's Berkshire Hathaway Bright Rock Capital Management completely sold its Berkshire Hathaway position in Q2 2025, with top holdings now including Microsoft, Alphabet, Mastercard, and Chubb."
2025-07-26 14:11:40+00:00,https://www.fool.com/investing/2025/07/26/1-reason-to-buy-visa-v/?source=iedfolrf0000001,"1 Reason to Buy Visa (V) Visa is a leading global payments platform with massive transaction volume and network reach, processing 233.8 billion transactions valued at $15.7 trillion in fiscal 2024. Despite potential challenges from emerging technologies like stablecoins, the company maintains a strong competitive position."
2025-07-26 14:30:00+00:00,https://www.fool.com/investing/2025/07/26/can-coca-cola-stock-keep-beating-the-market/?source=iedfolrf0000001,"Can Coca-Cola Stock Keep Beating the Market? Coca-Cola is experiencing a market-beating year with modest revenue growth, stable dividend, and reliable performance, though not considered a high-growth stock. The company has improved its financial position and maintains consistent dividend increases."
2025-07-26 19:33:00+00:00,https://www.fool.com/investing/2025/07/26/this-warren-buffett-stock-is-contemplating-a-huge/?source=iedfolrf0000001,"This Warren Buffett Stock Is Reportedly Contemplating a Huge Move Kraft Heinz is exploring a potential business spinoff into two segments: sauces/spreads and processed meats/cheeses, in response to poor stock performance and changing consumer preferences towards healthier food options."
2025-07-29 00:15:00+00:00,https://www.fool.com/investing/2025/07/28/2-no-brainer-warren-buffett-stocks-to-buy-right-no/?source=iedfolrf0000001,"2 No-Brainer Warren Buffett Stocks to Buy Right Now Warren Buffett continues to invest in Amazon and Visa, two companies with strong market positions in e-commerce, digital payments, and emerging technologies like AI and cloud computing."
2025-07-29 21:09:57+00:00,https://www.fool.com/investing/2025/07/29/investing-myth-timing-market-why-patience/?source=iedfolrf0000001,"Investing Myth: Timing the Market. Here's Why Patience Beats Prediction. Attempting to time the stock market by buying at the bottom and selling at the top is impossible. Investors should focus on long-term investment strategies, as the S&P 500 historically generates an average annual return of 9% when invested over extended periods."
2025-07-29 21:31:00+00:00,https://www.investing.com/analysis/should-investors-lock-arms-with-buffett-and-dive-into-this-stock-200664534,"Should Investors Lock Arms With Buffett and Dive Into This Stock? Warren Buffett's Berkshire Hathaway has quietly built a significant position in Pool, a wholesale distributor of swimming pool supplies, betting on long-term trends like rising global temperatures and population migration to warmer states."
2025-08-01 22:15:00+00:00,https://www.investing.com/analysis/berkshire-hathaway-earnings-preview-wall-street-eyes-cash-pile-buyback-clues-200664726,"Berkshire Hathaway Earnings Preview: Wall Street Eyes Cash Pile, Buyback Clues Berkshire Hathaway prepares for Q2 2025 earnings report, with investors focusing on cash reserves, potential share buybacks, and the leadership transition from Warren Buffett to Greg Abel."
2025-08-02 07:06:00+00:00,https://www.fool.com/investing/2025/08/02/stock-market-never-pricier-warren-buffett-history/?source=iedfolrf0000001,"The Stock Market Has Never Been Pricier, According to Warren Buffett's Favorite Valuation Tool -- and History Is Clear What Happens Next Warren Buffett's market cap-to-GDP ratio indicates the stock market is at its most expensive level in 55 years, suggesting potential significant market pullback based on historical precedent. Buffett has been a net seller of stocks for 10 consecutive quarters, signaling caution."
2025-08-02 08:15:00+00:00,https://www.fool.com/investing/2025/08/02/this-surprising-pizza-stock-is-beating-the-market/?source=iedfolrf0000001,"This Surprising Pizza Stock Is Beating the Market in 2025. Time to Buy? Domino's Pizza has attracted Berkshire Hathaway's investment interest, with the stock showing historical strong performance but currently considered a 'hold' due to modest revenue growth and valuation concerns."
2025-08-03 07:23:00+00:00,https://www.fool.com/investing/2025/08/03/2-warren-buffett-stocks-to-buy-hand-over-fist-in-a/?source=iedfolrf0000001,"2 Warren Buffett Stocks to Buy Hand Over Fist in August The article discusses two high-yield energy stocks recommended by Warren Buffett's investment strategy: Chevron and Enterprise Products Partners, highlighting their long-term investment potential and consistent dividend performance."
2025-08-03 22:05:00+00:00,https://www.fool.com/investing/2025/08/03/should-you-buy-sirius-xm-stock-after-earnings/?source=iedfolrf0000001,"Should You Buy Sirius XM Stock After Earnings? Sirius XM reported declining revenue and subscribers in Q2, facing significant challenges from streaming services like Apple, Spotify, and YouTube. Despite consistent profitability and a low P/E ratio, the company's growth prospects appear limited."
2025-08-04 08:06:00+00:00,https://www.fool.com/investing/2025/08/04/warren-buffett-sends-warning-stock-market-do-next/?source=iedfolrf0000001,"Warren Buffett Sends Investors a $344 Billion Warning. History Says the Stock Market Will Do This Next. Warren Buffett's Berkshire Hathaway is holding $344 billion in cash and has been a net seller of stocks for 11 consecutive quarters, signaling caution about current market valuations. The S&P 500's high cyclically-adjusted price-to-earnings (CAPE) ratio suggests potential market decline in the next few years."
2025-08-04 11:30:00+00:00,https://www.fool.com/investing/2025/08/04/1-reason-to-buy-brkb-berkshire-hathaway-buffett/?source=iedfolrf0000001,"1 Reason to Buy Warren Buffett's Company, Berkshire Hathaway (BRK.B) Berkshire Hathaway, led by Warren Buffett, has an impressive 60-year track record of generating nearly 20% annual returns. With a diverse portfolio of businesses and stocks, the company remains a promising long-term investment despite upcoming leadership transition."
2025-08-04 12:05:00+00:00,https://www.fool.com/investing/2025/08/04/biggest-takeaway-coca-colas-earnings/?source=iedfolrf0000001,"The Biggest Takeaway From Coca-Cola's July 22 Earnings Report Coca-Cola reported strong Q2 2025 financial results, exceeding Wall Street estimates with $12.6 billion revenue and $0.87 adjusted earnings per share. The company demonstrated significant pricing power, with a 6% price/mix growth and a robust 30% net profit margin."
2025-08-05 07:02:00+00:00,https://www.fool.com/investing/2025/08/05/these-were-the-5-biggest-companies-in-1989-and-her/?source=iedfolrf0000001,"These Were the 5 Biggest Companies in 1989, and Here Are the 5 Biggest Companies Now In 1989, Japanese banks dominated the list of most valuable companies, with Exxon being the only non-Japanese firm. Today, tech companies like Nvidia have dramatically higher market capitalizations, reflecting shifts in global economic power and investor preferences."
2025-08-05 10:30:00+00:00,https://www.fool.com/investing/2025/08/05/apple-stock-analysis-buy-or-sell/?source=iedfolrf0000001,"Apple Stock Analysis: Buy or Sell? Warren Buffett has invested approximately 40% of Berkshire Hathaway's $293 billion portfolio in five artificial intelligence stocks, highlighting the growing significance of AI investments in his strategy."
2025-08-05 11:10:00+00:00,https://www.fool.com/investing/2025/08/05/a-major-shake-up-is-coming-to-berkshire-hathaway-t/?source=iedfolrf0000001,"A Major Shake-Up Is Coming to Berkshire Hathaway This Year. Here's Why I'm Still All In on the Stock Warren Buffett plans to retire at the end of 2024, handing leadership of Berkshire Hathaway to Greg Abel. Despite the leadership change, the article suggests Berkshire will continue its strong performance due to Abel's experience and the company's robust financial position."
2025-08-05 17:32:00+00:00,https://www.fool.com/investing/2025/08/05/the-3-best-warren-buffett-stocks-to-buy-right-now/?source=iedfolrf0000001,"The 3 Best Warren Buffett Stocks to Buy Right Now As Warren Buffett prepares to step down as CEO of Berkshire Hathaway in 2025, the company remains strong with a massive cash reserve and diverse business portfolio. The article highlights potential investment opportunities in Kroger, Coca-Cola, and Berkshire Hathaway itself during economic uncertainty."
2025-08-06 07:06:00+00:00,https://www.fool.com/investing/2025/08/06/warren-buffett-78-billion-buy-stock-over-6-years/?source=iedfolrf0000001,"Warren Buffett Spent $78 Billion Buying This Stock Over 6 Years -- but He's Now Gone 12 Straight Months Without Purchasing a Single Share Warren Buffett has stopped buying Berkshire Hathaway stock after six years of aggressive share buybacks, primarily due to high market valuations and the stock trading at a significant premium to book value."
2025-08-06 07:20:00+00:00,https://www.fool.com/investing/2025/08/06/could-this-bear-market-buy-help-you-become-a-milli/?source=iedfolrf0000001,"Could This Bear Market-Buy Help You Become a Millionaire? Coca-Cola is a stable, dividend-generating stock that has historically provided modest returns, underperforming the S&P 500. While it offers protection during economic challenges, it's unlikely to generate significant wealth on its own."
2025-08-06 09:23:00+00:00,https://www.fool.com/investing/2025/08/06/2-no-brainer-warren-buffett-stocks-to-buy-right-no/?source=iedfolrf0000001,"2 No-Brainer Warren Buffett Stocks to Buy Right Now The article analyzes Berkshire Hathaway's stock portfolio, highlighting American Express and Berkshire Hathaway itself as attractive long-term investment options, based on strong financial performance and potential growth."
2025-08-06 12:30:00+00:00,https://www.fool.com/investing/2025/08/06/3-warren-buffett-stocks-to-buy-hand-over-fist-in-a/?source=iedfolrf0000001,"2 Warren Buffett Stocks to Buy Hand Over Fist in August The article analyzes the financial performance of Visa and American Express, highlighting their robust growth, technological innovation, and potential for long-term investment. Both companies demonstrate resilience in consumer spending and strategic positioning in the financial technology sector."
2025-08-07 08:30:00+00:00,https://www.fool.com/investing/2025/08/07/warren-buffett-and-berkshire-hathaway-remain-cauti/?source=iedfolrf0000001,"Warren Buffett and Berkshire Hathaway Remain Cautious as Stocks Soar. Should Investors Follow Suit? Warren Buffett continues to be cautious about the stock market, selling more stocks than buying in Q2 and maintaining a massive $344 billion cash reserve. Berkshire Hathaway's Q2 results were mixed, with some business segments performing well while others experienced declines."
2025-08-09 09:08:00+00:00,https://www.fool.com/investing/2025/08/09/warren-buffett-just-took-a-multi-billion-dollar-wr/?source=iedfolrf0000001,"Warren Buffett Just Took a Multi-Billion-Dollar Writedown on One of Berkshire Hathaway's Longtime Holdings and Is Now Piling Into a Deep Value Opportunity With a 5% Yield Warren Buffett's Berkshire Hathaway marked down its Kraft Heinz investment by $5 billion and continued to invest in Sirius XM, purchasing over $100 million in stock while exploring potential strategic alternatives."
2025-08-10 07:15:00+00:00,https://www.fool.com/investing/2025/08/10/sirius-xm-stock-looks-cheap-or-does-it/?source=iedfolrf0000001,"Sirius XM Stock Looks Cheap -- or Does It? Sirius XM presents a complex investment opportunity with strong cash flow and shareholder returns, but faces challenges in subscriber growth and digital platform transition, making its future uncertain."
2025-08-10 12:15:00+00:00,https://www.fool.com/investing/2025/08/10/warren-buffetts-bright-warning-to-wall-street-here/?source=iedfolrf0000001,"Warren Buffett's Bright Warning to Wall Street: Here's What It Means for Berkshire Hathaway and the Stock Market Warren Buffett is showing caution in the stock market by accumulating cash and halting share buybacks, signaling potential overvaluation and high market risk."
2025-08-10 22:23:00+00:00,https://www.fool.com/investing/2025/08/10/after-sitting-on-the-sidelines-for-14-months-warre/?source=iedfolrf0000001,"After Sitting on the Sidelines For 14 Months, Warren Buffett Could Be Buying One of His Favorite Stocks Again Warren Buffett has been a net seller of stocks for 11 consecutive quarters, but Berkshire Hathaway's stock price decline might make it an attractive buyback opportunity, with shares trading near intrinsic value."
2025-08-12 07:06:00+00:00,https://www.fool.com/investing/2025/08/12/warren-buffett-issued-344-billion-ominous-warning/?source=iedfolrf0000001,"Warren Buffett Just Issued a $344 Billion Ominous Warning to Wall Street -- but Are Investors Paying Attention? Warren Buffett's Berkshire Hathaway is holding $344.1 billion in cash and U.S. Treasuries, signaling caution about current stock market valuations. The company has been a net seller of stocks for 11 consecutive quarters, suggesting Buffett believes the market is overpriced."
2025-08-12 09:22:00+00:00,https://www.fool.com/investing/2025/08/12/is-occidental-petroleum-a-buy-on-the-dip/?source=iedfolrf0000001,"Is Occidental Petroleum a Buy on the Dip? Occidental Petroleum (Oxy) is a growth-oriented energy company with Warren Buffett's backing, seeking to compete with larger industry players like ExxonMobil and Chevron through strategic acquisitions and expansion."
2025-08-12 11:23:00+00:00,https://www.fool.com/investing/2025/08/12/these-are-the-largest-financial-stocks-by-market-c/?source=iedfolrf0000001,"These Are the Largest Financial Stocks by Market Cap. Here Are the 3 I'd Buy Today. The article discusses the largest financial stocks in the U.S., highlighting Berkshire Hathaway, Bank of America, and Wells Fargo as attractive investment opportunities based on their valuations and potential growth."
2025-08-12 17:07:00+00:00,https://www.fool.com/investing/2025/08/12/if-you-invested-1000-berkshire-hathaway-5-years/?source=iedfolrf0000001,"If You'd Invested $1,000 in Berkshire Hathaway Stock 5 Years Ago, Here's How Much You'd Have Today An investment of $1,000 in Berkshire Hathaway in August 2020 would have grown to $2,221 by August 2023, outperforming the S&P 500 with a 17.3% annualized growth rate despite recent market challenges."
2025-08-13 17:33:00+00:00,https://www.fool.com/investing/2025/08/13/should-you-buy-berkshire-hathaway-while-its-below/?source=iedfolrf0000001,"Should You Buy Berkshire Hathaway While It's Below $470? Berkshire Hathaway's stock has declined around 15% following Warren Buffett's retirement announcement, but the potential leadership transition with Greg Abel might not be as disruptive as investors fear, given Abel's long history with Buffett."
2025-08-14 08:19:00+00:00,https://www.fool.com/investing/2025/08/14/is-byd-the-smartest-investment-you-can-make-today/?source=iedfolrf0000001,"Is BYD the Smartest Investment You Can Make Today? BYD, a Chinese automaker, has experienced exponential growth in EV sales, surpassing Tesla and expanding globally with innovative battery technology and strategic pricing. Despite strong performance, the company faces challenges from market volatility and geopolitical tensions."
2025-08-14 10:30:00+00:00,https://www.fool.com/investing/2025/08/14/1-dividend-paying-dow-jones-stock-to-buy-in-august/?source=iedfolrf0000001,"1 Dividend-Paying Dow Jones Stock to Buy in August Honeywell plans to split into three separate publicly traded businesses: Automation, Aerospace, and Solstice Advanced Materials by 2026, aiming to unlock shareholder value and improve performance across business segments."
2025-08-14 19:29:00+00:00,https://www.investing.com/analysis/berkshire-hathaway-and-micron-offer-rare-value-in-a-stretched-market-200665347,"Berkshire Hathaway and Micron Offer Rare Value in a Stretched Market Despite record-high market valuations, Berkshire Hathaway and Micron Technology present attractive investment opportunities with undervalued stocks and significant potential upside."
2025-08-15 08:05:00+00:00,https://www.fool.com/investing/2025/08/15/buy-berkshire-stock-warren-buffett-sends-answer/?source=iedfolrf0000001,"Should You Buy Berkshire Hathaway Stock While It's Under $500? Warren Buffett Gives Investors a Clear Answer. Berkshire Hathaway's stock has dropped 12% from its record high, with Wall Street analysts believing it's undervalued. However, Warren Buffett has not repurchased shares in four quarters, suggesting the stock might not be attractively priced."
2025-08-15 10:15:00+00:00,https://www.fool.com/investing/2025/08/15/is-unitedhealth-group-a-buy-after-warren-buffett-e/?source=iedfolrf0000001,"Is UnitedHealth Group a Buy After Warren Buffett Enters the Picture? Warren Buffett's Berkshire Hathaway invested $1.6 billion in UnitedHealth Group, a healthcare company facing challenges including federal investigations and high medical costs. Despite current difficulties, Buffett sees potential value in the stock trading near a decade-low valuation."
2025-08-15 10:21:00+00:00,https://www.fool.com/investing/2025/08/15/should-you-buy-berkshire-hathaway-stock-even-thoug/?source=iedfolrf0000001,"Should You Buy Berkshire Hathaway Stock, Even Though It's Down 10% Since Warren Buffett Announced He's Retiring as CEO? Berkshire Hathaway stock dropped 11% after Warren Buffett announced his retirement, but the company's fundamental value remains strong. Greg Abel will succeed Buffett, and the business model is expected to remain largely unchanged."
2025-08-15 21:31:00+00:00,https://www.fool.com/investing/2025/08/15/stock-margin-debt-hit-1-trillion-buffet-casino/?source=iedfolrf0000001,"Stock Market Margin Debt Tops $1 Trillion: Is Warren Buffett's ""Casino"" Warning Starting to Bite? U.S. stock market margin debt has exceeded $1 trillion, signaling high investor risk and potential market volatility. Warren Buffett warns of market euphoria and potential future corrections, advising investors to focus on solid business fundamentals."
2025-08-17 07:06:00+00:00,https://www.fool.com/investing/2025/08/17/warren-buffett-mystery-stock-revealed-wall-street/?source=iedfolrf0000001,"Warren Buffett's Mystery Stock Is Revealed, and It Comes as a Big Surprise to Wall Street Warren Buffett's Berkshire Hathaway revealed a surprise $1.6 billion investment in UnitedHealth Group, a healthcare stock that recently experienced significant price decline due to Medicare Advantage segment challenges."
2025-08-18 07:06:00+00:00,https://www.fool.com/investing/2025/08/18/billionaire-warren-buffett-sold-41-berkshire-bofa/?source=iedfolrf0000001,"Billionaire Warren Buffett Sold 41% of Berkshire's Stake in Bank of America and Is Piling Into a Famed Consumer Brand That's Soared 7,200% Since Its IPO Warren Buffett continues to sell Bank of America shares while increasing Berkshire Hathaway's stake in Domino's Pizza, driven by strategic financial considerations and the pizza chain's strong performance and growth potential."
2025-08-18 15:45:26+00:00,https://www.benzinga.com/trading-ideas/movers/25/08/47189658/the-next-warren-buffett-opendoor-pumper-plans-mini-berkshire-for-retail-folks,"The Next Warren Buffett? Opendoor Pumper Plans 'Mini-Berkshire' For 'Retail Folks' Eric Jackson, an Opendoor supporter, plans to create a 'mini-Berkshire' investment opportunity for retail investors, drawing inspiration from Warren Buffett's long-term value investing strategy and projecting significant potential growth for Opendoor."
2025-08-18 21:20:04+00:00,https://www.fool.com/investing/2025/08/18/why-unitedhealth-stock-pushed-higher-on-monday/?source=iedfolrf0000001,"Why UnitedHealth Stock Pushed Higher on Monday UnitedHealth Group's stock rose nearly 2% after Bank of America analyst Kevin Fischbeck raised its price target to $325, and following Warren Buffett's Berkshire Hathaway's $1.6 billion investment in the company."
