timestamp,url,text
2025-01-01 11:45:00+00:00,https://www.fool.com/investing/2025/01/01/billionaires-couldnt-get-enough-of-this-etf-in/?source=iedfolrf0000001,"Billionaires Couldn't Get Enough of This ETF in 2024. Is It Right for You in 2025? The article discusses the Vanguard S&P 500 ETF (VOO) and its popularity among billionaire investors, including Warren Buffett. It highlights the ETF's low cost, diversification, and strong historical performance as reasons for its appeal."
2025-01-01 12:10:00+00:00,https://www.fool.com/investing/2025/01/01/prediction-warren-buffetts-berkshire-hathaway/?source=iedfolrf0000001,"Prediction: Warren Buffett's Berkshire Hathaway Stock Will Outperform the S&P 500 in 2025 The article predicts that Berkshire Hathaway will outperform the S&P 500 in 2025, as Berkshire has reduced its exposure to high-flying tech stocks and holds more value-oriented and inflation-hedging assets."
2025-01-02 14:30:00+00:00,https://www.fool.com/investing/2025/01/02/3-reasons-to-buy-kraft-heinz-stock-like-theres-no/?source=iedfolrf0000001,"3 Reasons to Buy Kraft Heinz Stock Like There's No Tomorrow Kraft Heinz, a packaged foods giant, had a challenging 2024 with weak growth and disappointing earnings. However, the company's strong brand portfolio, financial efficiencies, and attractive valuation suggest a potential turnaround in 2025, making it a compelling investment opportunity for investors."
2025-01-03 11:10:00+00:00,https://www.fool.com/investing/2025/01/03/3-top-value-stocks-to-buy-in-january/?source=iedfolrf0000001,"3 Top Value Stocks to Buy in January The article discusses three undervalued stocks that could benefit from an economic rebound in 2023: JPMorgan Chase, Target, and Berkshire Hathaway. It highlights the potential for these companies to outperform the market as value stocks gain favor."
2025-01-03 11:15:00+00:00,https://www.fool.com/investing/2025/01/03/1-warren-buffett-stock-to-buy-hand-over-fist-in-ja/?source=iedfolrf0000001,"1 Warren Buffett Stock to Buy Hand Over Fist in January Chevron is a strong investment option, with a history of increasing dividends, a robust balance sheet, and plans for growth in the Permian Basin. Warren Buffett's Berkshire Hathaway has maintained a significant position in Chevron, indicating its value."
2025-01-04 11:06:00+00:00,https://www.fool.com/investing/2025/01/04/3-unstoppable-stocks-build-portfolio-2025/?source=iedfolrf0000001,"3 Unstoppable Stocks to Build a Portfolio Around for 2025 and Beyond The article recommends investing in Amazon, Alphabet, and Berkshire Hathaway as excellent starter stocks for 2025. It highlights the growth opportunities in e-commerce, advertising, cloud computing, and Berkshire's strong financial position."
2025-01-04 16:41:00+00:00,https://www.fool.com/investing/2025/01/04/5-reasons-to-buy-dominos-pizza-stock-like-theres-n/?source=iedfolrf0000001,"5 Reasons to Buy Domino's Pizza Stock Like There's No Tomorrow Domino's Pizza is a successful fast-food chain that has delivered impressive returns for long-term investors. The article outlines five reasons to buy the stock, including its fast, affordable, and customizable pizza, its growing market share, and its franchise business model with stable revenue streams."
2025-01-05 10:46:00+00:00,https://www.fool.com/investing/2025/01/05/this-top-warren-buffett-stock-could-soar-even-high/?source=iedfolrf0000001,"This Top Warren Buffett Stock Could Soar Even Higher in 2025. Time to Buy? Berkshire Hathaway's largest holding after Apple is American Express, which the company has been steadfastly holding onto despite the stock's strong performance in 2024. American Express has been able to grow earnings at a high rate due to its unique business model, and its current valuation suggests it could be an attractive long-term investment."
2025-01-06 10:06:00+00:00,https://www.fool.com/investing/2025/01/06/5-stocks-warren-buffett-is-betting-big-on-for-2025/?source=iedfolrf0000001,"5 Stocks Warren Buffett Is Betting Big On for 2025 Warren Buffett is betting big on five stocks in 2025: Sirius XM, Occidental Petroleum, Domino's Pizza, Chubb, and Berkshire Hathaway. These companies have strong competitive advantages, steady cash flows, and attractive valuations that appeal to the value-oriented Buffett."
2025-01-06 13:00:00+00:00,https://www.fool.com/investing/2025/01/06/5-reasons-to-buy-coca-cola-stock-like-theres-no/?source=iedfolrf0000001,"5 Reasons to Buy Coca-Cola Stock Like There's No Tomorrow The article highlights 5 key reasons to invest in Coca-Cola stock, including its global reach, steady growth, profitability, and reliable dividend. It argues that Coca-Cola is a durable, long-term investment opportunity."
2025-01-08 10:06:00+00:00,https://www.fool.com/investing/2025/01/08/325-billion-warren-buffett-buy-favorite-stock-2025/?source=iedfolrf0000001,"325 Billion Reasons Warren Buffett Is Virtually Guaranteed to Buy His Favorite Stock in 2025 Warren Buffett's Berkshire Hathaway has accumulated a record $325 billion in cash, and the company is expected to use this to repurchase its own shares in 2025, as Buffett has been doing for the past 24 quarters."
2025-01-08 10:12:00+00:00,https://www.fool.com/investing/2025/01/08/warren-buffetts-warning-to-investors-is-hard-to-ig/?source=iedfolrf0000001,"Warren Buffett's Warning to Investors Is Hard to Ignore The article discusses how Warren Buffett's Berkshire Hathaway has been selling stocks, suggesting a potential market downturn, but advises that investors shouldn't avoid the market completely and should focus on finding individual bargains."
2025-01-08 16:45:00+00:00,https://www.fool.com/investing/2025/01/08/1-warren-buffett-stock-that-could-go-parabolic-in/?source=iedfolrf0000001,"1 Warren Buffett Stock That Could Go Parabolic in 2025 and Beyond Sirius XM's stock price plummeted in 2023, but Berkshire Hathaway has been adding to its position. The article suggests that the stock is now attractively valued for value and income investors, with potential catalysts for a turnaround in 2025."
2025-01-09 10:49:00+00:00,https://www.fool.com/investing/2025/01/09/is-wall-street-more-bullish-about-berkshire-hathaw/?source=iedfolrf0000001,"Is Wall Street More Bullish About Berkshire Hathaway Right Now Than Warren Buffett? Wall Street analysts are more bullish on Berkshire Hathaway in the short term, with an average 12-month price target reflecting a 10% upside. However, Warren Buffett, Berkshire's chairman, appears less enthusiastic, as he has not repurchased any shares in the last quarter, likely due to concerns about the stock's valuation."
2025-01-09 15:15:00+00:00,https://www.fool.com/investing/2025/01/09/billionaire-bill-gates-has-66-of-his-foundations/?source=iedfolrf0000001,"Billionaire Bill Gates Has 66% of His Foundation's $44 Billion Portfolio Invested in 3 Phenomenal Stocks Bill Gates' foundation has invested 66% of its $44 billion portfolio in three stocks: Microsoft, Berkshire Hathaway, and Waste Management. The article highlights the strong performance and growth prospects of these companies."
2025-01-11 09:23:00+00:00,https://www.fool.com/investing/2025/01/11/warren-buffett-just-sold-nu-stock-heres-why-you-pr/?source=iedfolrf0000001,"Warren Buffett Just Sold Nu Stock. Here's Why You Probably Shouldn't. Berkshire Hathaway has reduced its stake in Nu Holdings, a digital bank based in Brazil, by 19%. However, Buffett still maintains a significant position, indicating his continued confidence in the company's long-term potential. Nu Holdings is navigating challenges posed by Brazil's volatile economy, but its robust credit business and growth in new markets suggest it remains an attractive investment opportunity for risk-tolerant investors."
2025-01-11 09:28:00+00:00,https://www.fool.com/investing/2025/01/11/warren-buffett-sp-500-funds-soar-153-wall-street/?source=iedfolrf0000001,"Warren Buffett Owns 2 S&P 500 Index Funds. They Could Soar 153%, According to a Top Wall Street Analyst Warren Buffett's Berkshire Hathaway owns two S&P 500 index funds, the Vanguard S&P 500 ETF and the SPDR S&P 500 ETF Trust, which a top Wall Street analyst believes could see a 153% gain by 2030 due to factors like AI and the prime earning years of millennials and Gen Zers."
2025-01-11 13:15:00+00:00,https://www.fool.com/investing/2025/01/11/2-warren-buffett-stocks-to-buy-hand-over-fist-in/?source=iedfolrf0000001,"2 Warren Buffett Stocks to Buy Hand Over Fist in January The article discusses the investment potential of Bank of America and American Express, two stocks that are part of Berkshire Hathaway's portfolio. It highlights the positive outlook for Bank of America's financials and American Express' strong customer base and product strategy."
2025-01-11 16:23:00+00:00,https://www.fool.com/investing/2025/01/11/is-warren-buffett-preparing-to-save-wall-street-fr/?source=iedfolrf0000001,"Is Warren Buffett Preparing to Save Wall Street From Itself? History Shows What the Billionaire Legend Could Be Doing With His Record $325 Billion in Cash. Berkshire Hathaway, led by Warren Buffett, has amassed a record $325 billion in cash, leading to speculation that Buffett may be preparing to strategically invest in companies during a potential financial crisis, similar to his actions during the Great Recession."
2025-01-11 23:14:00+00:00,https://www.fool.com/investing/2025/01/11/berkshire-hathaway-buy-sell-or-hold/?source=iedfolrf0000001,"Berkshire Hathaway: Buy, Sell, or Hold? Berkshire Hathaway, Warren Buffett's holding company, has created significant wealth over the decades. However, its current high valuation relative to historical norms makes it a less attractive buy today, despite its strong track record. Investors should consider holding on to the stock if they already own it, but may want to wait for a more favorable valuation before making a new investment."
2025-01-12 10:30:00+00:00,https://www.fool.com/investing/2025/01/12/warren-buffetts-warning-to-wall-street-reached-dea/?source=iedfolrf0000001,"Warren Buffett's Warning to Wall Street Reached Deafening Levels Last Year, but There's Now a Silver Lining. Warren Buffett and Berkshire Hathaway's actions in 2024 suggested the market was overvalued, with the company stockpiling cash and selling more stocks than it bought. However, recent purchases of Occidental Petroleum, Sirius XM Holdings, and VeriSign indicate Buffett sees opportunities in the current market."
2025-01-12 13:05:00+00:00,https://www.fool.com/investing/2025/01/12/is-berkshire-hathaway-stock-a-millionaire-maker/?source=iedfolrf0000001,"Is Berkshire Hathaway Stock a Millionaire Maker? Berkshire Hathaway, led by Warren Buffett, is a diverse conglomerate with a strong insurance business that provides a steady flow of capital for investments. While the company has delivered impressive returns, its future after Buffett's departure is a concern, though transition plans are in place."
2025-01-12 13:15:00+00:00,https://www.fool.com/investing/2025/01/12/nu-holdings-buy-sell-or-hold/?source=iedfolrf0000001,"Nu Holdings: Buy, Sell, or Hold? Nu Holdings, a fintech company with a $53 billion market cap, has seen its stock price drop 30% since November. The company has experienced rapid growth, with revenue and customer numbers surging. Despite the recent dip, the stock appears undervalued compared to its growth and profitability, making it a potential buying opportunity for long-term investors."
2025-01-14 01:30:00+00:00,https://www.fool.com/investing/2025/01/13/warren-buffett-just-added-94-million-to-this-long/?source=iedfolrf0000001,"Warren Buffett Just Added $94 Million to This Long-Time Holding That's Up More Than 325% Since He First Bought Shares Warren Buffett has been trimming some of Berkshire Hathaway's biggest stock positions, but he recently added $94 million to his long-time holding Verisign, which has increased over 325% since he first bought shares in 2012. Verisign's monopoly on popular domain names and steady revenue growth make it an attractive investment."
2025-01-14 14:43:00+00:00,https://www.fool.com/retirement/2025/01/14/i-want-to-be-an-ira-millionaire-by-retirement-here/?source=iedfolrf0000001,"I Want to Be an IRA Millionaire by Retirement. Here's How I'm Planning to Get There. The article discusses strategies to become an IRA millionaire by retirement, including consistently contributing to an IRA, investing in stocks and funds with minimal downside risk, and maintaining an appropriate asset allocation."
2025-01-15 09:22:00+00:00,https://www.fool.com/investing/2025/01/15/warren-buffett-favorite-stock-buying-berkshire/?source=iedfolrf0000001,"Warren Buffett Has Plowed $77.8 Billion Into His Favorite Stock Since 2018. Why Did He Recently Stop Buying It? Warren Buffett's Berkshire Hathaway has been a major buyer of its own stock, investing $77.8 billion since 2018. However, the company did not repurchase any shares in the third quarter of 2024, which could signal Buffett's caution about the market's valuation."
2025-01-15 11:03:00+00:00,https://www.fool.com/investing/2025/01/15/bill-ackman-plans-to-build-the-next-berkshire-hath/?source=iedfolrf0000001,Bill Ackman Plans to Build the Next Berkshire Hathaway -- Here's How You Can Invest in It Billionaire hedge fund manager Bill Ackman plans to create a modern-day Berkshire Hathaway by acquiring a majority stake in Howard Hughes Holdings and using it as a platform to acquire controlling interests in other businesses.
2025-01-15 20:39:07+00:00,https://www.fool.com/investing/2025/01/15/why-occidental-petroleum-stock-slumped-17-in-2024/?source=iedfolrf0000001,"Why Occidental Petroleum Stock Slumped 17% in 2024 but Could Rally in 2025 Occidental Petroleum (OXY) had a challenging 2024, with its stock price declining 17.3% despite Warren Buffett's Berkshire Hathaway consistently buying shares. However, the company has made progress in reducing debt and generating strong cash flows from a recent acquisition, positioning it as a potential turnaround story for 2025."
2025-01-16 09:52:00+00:00,https://www.fool.com/investing/2025/01/16/is-it-time-to-worry-about-apple/?source=iedfolrf0000001,"A Perhaps Surprising but Serious Question: Is It Time to Worry About Apple? The article discusses potential warning signs for Apple, including a decline in iPhone shipments in China, the impact of proposed tariffs, and the underwhelming performance of Apple Intelligence and Vision Pro. However, the author concludes that it's too soon to worry about Apple, as the company's iPhone-centered ecosystem and strong financial position warrant a premium valuation."
2025-01-16 12:20:00+00:00,https://www.fool.com/investing/2025/01/16/is-ally-stock-a-buy-now/?source=iedfolrf0000001,"Is Ally Stock a Buy Now? Ally Financial, a mid-sized all-digital bank, has underperformed its peers in 2024 but presents long-term value for investors. The company has a strong auto-lending business and a growing digital platform, but has faced some pressure due to rising defaults. However, management has taken steps to address this, and the stock is currently trading at a low valuation."
2025-01-16 12:50:00+00:00,https://www.fool.com/investing/2025/01/16/should-you-buy-berkshire-hathaway-while-its-below/?source=iedfolrf0000001,"Should You Buy Berkshire Hathaway While It's Below $480? Berkshire Hathaway, led by Warren Buffett, has delivered nearly 20% annual returns for over six decades, outpacing the S&P 500. The company's diverse portfolio of wholly owned businesses and insurance holdings provide significant cash flows, and its $325 billion in cash and short-term investments give it flexibility for future investments."
2025-01-16 16:08:24+00:00,https://www.fool.com/investing/2025/01/16/should-investors-buy-siriusxm-stock-before-january/?source=iedfolrf0000001,Should Investors Buy SiriusXM Stock Before Jan. 30? SiriusXM has been gaining more attention from investors since Warren Buffett's Berkshire Hathaway started buying the stock.
2025-01-18 09:32:00+00:00,https://www.fool.com/investing/2025/01/18/does-this-massive-news-signal-trouble-ahead-for-ul/?source=iedfolrf0000001,"Does This Massive News Signal Trouble Ahead for Ulta Beauty Stock in 2025? Ulta Beauty had a tough 2024, with its stock falling 11% while the S&P 500 gained 25%. The company is now facing a CEO change, with Kecia Steelman taking over from Dave Kimbell. While the market reacted negatively to the news, Steelman's experience and a potential shift towards higher-margin services could help Ulta rebound in 2025."
2025-01-18 11:30:00+00:00,https://www.fool.com/investing/2025/01/18/largest-companies-world-berkshire-hathaway-brk/?source=iedfolrf0000001,"This Is One of the Largest Companies in the World...and the Stock Is an Absolute Bargain Berkshire Hathaway, one of the largest publicly traded companies, is considered a bargain investment due to its diversified business model and Warren Buffett's proven track record, despite its high valuation metrics."
2025-01-18 15:15:00+00:00,https://www.fool.com/investing/2025/01/18/buffetts-warning-3-things-investors-need-to-do/?source=iedfolrf0000001,"Warren Buffett's Wall Street Warning: 3 Things Investors Need to Do in 2025 The article discusses Warren Buffett's actions and advice for investors in 2025, including avoiding leverage, not chasing high-growth stocks at nosebleed valuations, and maintaining proper diversification."
2025-01-19 10:54:00+00:00,https://www.fool.com/investing/2025/01/19/top-dividend-stock-800-million-warren-buffett/?source=iedfolrf0000001,"This Top Dividend Stock Generates Almost $800 Million Annually for Warren Buffett-led Berkshire Hathaway: Should You Buy? Coca-Cola is a top dividend stock that generates nearly $800 million in annual income for Berkshire Hathaway. While it has a stable business and consistent dividend growth, its growth prospects are limited, making it less attractive for investors seeking market-beating returns."
2025-01-19 13:03:00+00:00,https://www.fool.com/investing/2025/01/19/could-this-little-known-company-become-the-next-be/?source=iedfolrf0000001,Could This Little-Known Company Become the Next Berkshire Hathaway? Billionaire hedge fund manager Bill Ackman plans to take control of real estate development company Howard Hughes Holdings and use it as Pershing Square's modern-day Berkshire Hathaway.
2025-01-20 08:50:00+00:00,https://www.fool.com/investing/2025/01/20/will-donald-trump-heed-warren-buffetts-stark-warni/?source=iedfolrf0000001,"Will Donald Trump Heed Warren Buffett's Stark Warning About Tariffs? The article discusses Trump's proposed tariffs, including steep tariffs on imports from China, Canada, and Mexico. It also highlights Warren Buffett's warnings about the negative economic impact of such tariffs leading to a trade war."
2025-01-20 08:56:00+00:00,https://www.fool.com/investing/2025/01/20/billionaire-stanley-druckenmiller-is-buying-a-high/?source=iedfolrf0000001,"Billionaire Stanley Druckenmiller Is Buying a High-Yield Warren Buffett Stock That Looks Like a Bargain Now Billionaire investor Stanley Druckenmiller has opened a new position in Citigroup, a stock that is also owned by Warren Buffett's Berkshire Hathaway. Citigroup is trading at a low valuation and has made progress in simplifying its operations, which could lead to improved profitability."
2025-01-20 09:48:00+00:00,https://www.fool.com/investing/2025/01/20/2-etfs-that-went-up-30-or-more-in-2024-will-they-d/?source=iedfolrf0000001,"2 ETFs That Went Up 30% or More in 2024: Will They Do It Again in 2025? The article discusses the strong performance of the Financial Select Sector SPDR ETF (XLF) and the Ark Autonomous Technology & Robotics ETF (ARKQ) in 2024, and the potential catalysts for their continued outperformance in 2025. It also highlights the factors that contributed to the financial sector's outperformance and the risks that could affect the future performance of these ETFs."
2025-01-20 10:30:00+00:00,https://www.fool.com/investing/2025/01/20/is-siriusxm-stock-undervalued-at-current-prices/?source=iedfolrf0000001,"Is SiriusXM Stock Undervalued at Current Prices? The article discusses how Berkshire Hathaway has been increasing its purchases of SiriusXM stock, suggesting that Warren Buffett believes it is a good investment."
2025-01-20 13:15:00+00:00,https://www.fool.com/investing/2025/01/20/should-you-buy-nu-holdings-while-its-below-14/?source=iedfolrf0000001,"Should You Buy Nu Holdings While It's Below $14? Nu Holdings, a digital bank in Brazil, has disrupted the traditional banking sector by offering free accounts, credit cards, and reduced borrowing costs. The company has seen rapid growth, reaching over 56% of Brazil's adult population. However, it faces concerns about rising credit delinquencies and a recent stock price decline."
2025-01-20 14:48:00+00:00,https://www.globenewswire.com/news-release/2025/01/20/3012148/28124/en/2024-Global-Motor-Insurance-Market-Report-Now-Available.html,"2024 Global Motor Insurance Market Report | Now Available The report provides an in-depth analysis of the global and regional motor insurance industry, including key trends, drivers, challenges, and a competitive landscape analysis. It offers historical data and forecasts for the industry from 2020 to 2029."
2025-01-21 00:02:00+00:00,https://www.benzinga.com/pressreleases/25/01/g43087643/purpose-investments-inc-announces-january-2025-distributions,Purpose Investments Inc. Announces January 2025 Distributions Purpose Investments Inc. announced the January 2025 distributions for its open-end exchange-traded funds and closed-end funds.
2025-01-21 12:37:00+00:00,https://www.fool.com/investing/2025/01/21/warren-buffett-sold-this-stock-but-i-think-hes-com/?source=iedfolrf0000001,"Warren Buffett Sold This Stock, but I Think He's Completely Wrong The article argues that Warren Buffett made a mistake by selling Berkshire Hathaway's stake in General Motors, as the company has been performing well, with strong earnings, increased market share, and aggressive share buybacks. The author believes GM's stock is undervalued and could be a 'tremendous bargain' for investors."
2025-01-22 09:15:00+00:00,https://www.fool.com/investing/2025/01/22/this-ridiculously-cheap-warren-buffett-stock-could/?source=iedfolrf0000001,"This Ridiculously Cheap Warren Buffett Stock Could Make You Richer Kraft Heinz, a company in Berkshire Hathaway's portfolio, has faced challenges but is showing signs of recovery. Despite a low valuation and high dividend yield, the company's growth outlook is modest as it navigates inflation and a difficult market environment."
2025-01-22 10:30:00+00:00,https://www.fool.com/investing/2025/01/22/where-will-sirius-xm-be-in-1-year/?source=iedfolrf0000001,"Where Will Sirius XM Be in 1 Year? Sirius XM Holdings, a satellite radio company, is undergoing a turnaround after a challenging 2024. The company is focusing on its core automotive customers, introducing new pricing tiers, and launching a free ad-supported tier to attract more subscribers. Berkshire Hathaway, led by Warren Buffett, has increased its stake in Sirius XM, betting on the company's turnaround in 2025."
2025-01-22 15:06:58+00:00,https://www.fool.com/investing/2025/01/22/should-you-buy-apple-stock-before-jan-30/?source=iedfolrf0000001,Should You Buy Apple Stock Before Jan. 30? The article discusses the growing importance of artificial intelligence (AI) for the world's largest companies and why investors should pay attention to these developments.
2025-01-23 09:51:00+00:00,https://www.fool.com/investing/2025/01/23/if-i-could-only-buy-and-hold-a-single-stock-this-w/?source=iedfolrf0000001,"If I Could Only Buy and Hold a Single Stock, This Would Be It Berkshire Hathaway is a diversified investment holding company with a large cash stockpile, making it well-positioned to thrive even in a downturn. The company's subsidiaries and stock portfolio provide exposure to a wide range of industries, offering investors a diversified investment option in a single stock."
2025-01-23 11:12:00+00:00,https://www.fool.com/investing/2025/01/23/got-1000-this-top-performing-stock-could-turn-it-i/?source=iedfolrf0000001,"Got $1,000? This Top-Performing Stock Could Turn It Into Nearly $3,000 by 2029. Brookfield Corporation has delivered exceptional returns over the past few decades, outperforming the S&P 500 and other top-performing companies. The company believes it can continue to grow its value to $176 per share by 2029, driven by growth in its infrastructure, renewable energy, and wealth solutions businesses, as well as its ability to deploy its growing free cash flow."
2025-01-23 13:45:00+00:00,https://www.fool.com/investing/2025/01/23/trading-near-its-52-week-low-is-dominos-pizza/?source=iedfolrf0000001,"Trading Near Its 52-Week Low, Is Domino's Pizza Stock a Bargain Buy? Domino's Pizza (DPZ) stock has been sliding despite Warren Buffett's Berkshire Hathaway buying a stake. The author believes the stock is too expensive to buy right now, as its valuation is high compared to its growth rate."
2025-01-24 09:14:00+00:00,https://www.fool.com/investing/2025/01/24/warren-buffett-stock-to-buy-hand-over-fist-nu/?source=iedfolrf0000001,"1 Warren Buffett Stock to Buy Hand Over Fist in January The article discusses Warren Buffett's investment in Nu Holdings, a fintech company in Latin America. Despite Nu's high valuation, Buffett sees long-term growth potential in the company's expansion and cross-selling opportunities."
